{"ai_hash_sha256": "ee9ab864ba5d40c3c807e166b56d6acf052aec19886ddba9da233658c0618fa1", "binding_hash": "3aff01918b18cc9d07f50d931ba123d920c958cfcfecafb7745a48845949bcf1", "canonicalization": "json_sorted_keys_no_whitespace_utf8", "input_schema": "ai_output_v1", "schema": "ai_pack_manifest_v1", "ts_utc": "2026-01-15T12:00:01Z"}
