{"ai_hash_sha256": "547298ea4f6f7795bf90d7e7196c82841ba50fa385ee7a2a290548c268d845c6", "binding_hash": "45255ba52c9225419ddf18152beef232803b79c551d642aa7256ec720b41d631", "canonicalization": "json_sorted_keys_no_whitespace_utf8", "input_schema": "ai_output_v1", "schema": "ai_pack_manifest_v1", "ts_utc": "2026-03-15T12:13:05Z"}
