{"ai_hash_sha256": "5676fd828237f98e5f7c713025901158df7b63e1c365bb0668beea6b727b7356", "binding_hash": "b9f5f6f3251f498f2f875929664c1d6f5c05a407d6c206dee1aa360de6f0fafb", "canonicalization": "json_sorted_keys_no_whitespace_utf8", "input_schema": "ai_output_v1", "schema": "ai_pack_manifest_v1", "ts_utc": "2026-01-15T12:00:01Z"}
